{
  "baseline_validation": {
    "feature_row_accepted": true,
    "intelligence_record_status": "accepted_with_warnings",
    "intelligence_record_valid": true,
    "purl_parsed": true,
    "version_parsed": true
  },
  "catalog": {
    "catalog_id": "AEGIS-HOSTILE-INPUT-CATALOG",
    "harness_version": "1.0.0",
    "relative_path": "policies/assurance/hostile_input_catalog_v1.yaml",
    "sha256": "c3ebeeae727c8613b76605edaf12912d1b9b5575f197a0dff03dd9e34b278ecb",
    "version": "1.0.0"
  },
  "generated_at": "2026-07-14T00:19:25.270684+00:00",
  "harness_error_input_ids": [],
  "input_integrity_checks_after": {
    "feature_parser_module": {
      "actual_sha256": "9ad5b77214627aaaa73b05bf3a86c0ed8e2543d78af040c239db4b3ded9a5bd2",
      "expected_sha256": "9ad5b77214627aaaa73b05bf3a86c0ed8e2543d78af040c239db4b3ded9a5bd2",
      "passed": true,
      "relative_path": "src/ingestion/vulnerability_feature_parser.py"
    },
    "intelligence_fixture": {
      "actual_sha256": "e2204ab8ff8736c0826ffe24d518cef462a75dcea7e498943506b0fe7f41ff1f",
      "expected_sha256": "e2204ab8ff8736c0826ffe24d518cef462a75dcea7e498943506b0fe7f41ff1f",
      "passed": true,
      "relative_path": "data/sample_inputs/intelligence/valid_log4shell_intelligence.json"
    },
    "intelligence_schema": {
      "actual_sha256": "b488403d7c8947e7e2b3fd40a49b48403606ea7d06bb40475eeb29be5aaac01d",
      "expected_sha256": "b488403d7c8947e7e2b3fd40a49b48403606ea7d06bb40475eeb29be5aaac01d",
      "passed": true,
      "relative_path": "schemas/aegis_vulnerability_intelligence.schema.json"
    },
    "intelligence_validator_module": {
      "actual_sha256": "559be8fd5f2c68af468e051dc886ebbc1089f4ec3e31a101b9c1acb08974bbd0",
      "expected_sha256": "559be8fd5f2c68af468e051dc886ebbc1089f4ec3e31a101b9c1acb08974bbd0",
      "passed": true,
      "relative_path": "src/validation/vulnerability_intelligence_validator.py"
    },
    "step11c_report": {
      "actual_sha256": "74f0849ee40aa73f09b9abf23929bbaf4a355d51f00c9b01958b01f943867a23",
      "expected_sha256": "74f0849ee40aa73f09b9abf23929bbaf4a355d51f00c9b01958b01f943867a23",
      "passed": true,
      "relative_path": "data/validation_reports/tampering/step11c_tamper_assurance_report.json"
    },
    "strict_parsing_fixture": {
      "actual_sha256": "127c929cb4f881d345155a6e3da273063b28ff36d42b07647f53d7dcecf388e7",
      "expected_sha256": "127c929cb4f881d345155a6e3da273063b28ff36d42b07647f53d7dcecf388e7",
      "passed": true,
      "relative_path": "data/sample_inputs/parsing/strict_parsing_cases.csv"
    },
    "strict_parsing_module": {
      "actual_sha256": "9f442aeda323f9917db6b5a88e61acce49f5d3235a694a9ccd4862c510f6fdcc",
      "expected_sha256": "9f442aeda323f9917db6b5a88e61acce49f5d3235a694a9ccd4862c510f6fdcc",
      "passed": true,
      "relative_path": "src/normalization/strict_parsing.py"
    },
    "versioning_module": {
      "actual_sha256": "b11d7d492997001667cff5cbc8f27db1f046ffcfb12b0c0bccdf4c5a1365f033",
      "expected_sha256": "b11d7d492997001667cff5cbc8f27db1f046ffcfb12b0c0bccdf4c5a1365f033",
      "passed": true,
      "relative_path": "src/affectedness/versioning.py"
    }
  },
  "input_integrity_checks_before": {
    "feature_parser_module": {
      "actual_sha256": "9ad5b77214627aaaa73b05bf3a86c0ed8e2543d78af040c239db4b3ded9a5bd2",
      "expected_sha256": "9ad5b77214627aaaa73b05bf3a86c0ed8e2543d78af040c239db4b3ded9a5bd2",
      "passed": true,
      "relative_path": "src/ingestion/vulnerability_feature_parser.py"
    },
    "intelligence_fixture": {
      "actual_sha256": "e2204ab8ff8736c0826ffe24d518cef462a75dcea7e498943506b0fe7f41ff1f",
      "expected_sha256": "e2204ab8ff8736c0826ffe24d518cef462a75dcea7e498943506b0fe7f41ff1f",
      "passed": true,
      "relative_path": "data/sample_inputs/intelligence/valid_log4shell_intelligence.json"
    },
    "intelligence_schema": {
      "actual_sha256": "b488403d7c8947e7e2b3fd40a49b48403606ea7d06bb40475eeb29be5aaac01d",
      "expected_sha256": "b488403d7c8947e7e2b3fd40a49b48403606ea7d06bb40475eeb29be5aaac01d",
      "passed": true,
      "relative_path": "schemas/aegis_vulnerability_intelligence.schema.json"
    },
    "intelligence_validator_module": {
      "actual_sha256": "559be8fd5f2c68af468e051dc886ebbc1089f4ec3e31a101b9c1acb08974bbd0",
      "expected_sha256": "559be8fd5f2c68af468e051dc886ebbc1089f4ec3e31a101b9c1acb08974bbd0",
      "passed": true,
      "relative_path": "src/validation/vulnerability_intelligence_validator.py"
    },
    "step11c_report": {
      "actual_sha256": "74f0849ee40aa73f09b9abf23929bbaf4a355d51f00c9b01958b01f943867a23",
      "expected_sha256": "74f0849ee40aa73f09b9abf23929bbaf4a355d51f00c9b01958b01f943867a23",
      "passed": true,
      "relative_path": "data/validation_reports/tampering/step11c_tamper_assurance_report.json"
    },
    "strict_parsing_fixture": {
      "actual_sha256": "127c929cb4f881d345155a6e3da273063b28ff36d42b07647f53d7dcecf388e7",
      "expected_sha256": "127c929cb4f881d345155a6e3da273063b28ff36d42b07647f53d7dcecf388e7",
      "passed": true,
      "relative_path": "data/sample_inputs/parsing/strict_parsing_cases.csv"
    },
    "strict_parsing_module": {
      "actual_sha256": "9f442aeda323f9917db6b5a88e61acce49f5d3235a694a9ccd4862c510f6fdcc",
      "expected_sha256": "9f442aeda323f9917db6b5a88e61acce49f5d3235a694a9ccd4862c510f6fdcc",
      "passed": true,
      "relative_path": "src/normalization/strict_parsing.py"
    },
    "versioning_module": {
      "actual_sha256": "b11d7d492997001667cff5cbc8f27db1f046ffcfb12b0c0bccdf4c5a1365f033",
      "expected_sha256": "b11d7d492997001667cff5cbc8f27db1f046ffcfb12b0c0bccdf4c5a1365f033",
      "passed": true,
      "relative_path": "src/affectedness/versioning.py"
    }
  },
  "limitations": [
    "The campaign uses controlled repository fixtures and does not replace live operational testing.",
    "Resource-exhaustion scenarios use bounded representative payloads rather than destructive denial-of-service loads.",
    "PURL validation implements a strict security profile and is not a complete conformance certification for every Package URL extension.",
    "Passing Step 11D does not replace independent security assessment or authorization to operate."
  ],
  "quality_gates": [
    {
      "gate_id": "GATE-CRITICAL-HOSTILE-INPUT-DEFENCE",
      "observed": 1.0,
      "operator": "gte",
      "passed": true,
      "threshold": 1.0
    },
    {
      "gate_id": "GATE-UNDETECTED-CRITICAL-INPUTS",
      "observed": 0,
      "operator": "lte",
      "passed": true,
      "threshold": 0
    },
    {
      "gate_id": "GATE-HARNESS-ERRORS",
      "observed": 0,
      "operator": "lte",
      "passed": true,
      "threshold": 0
    },
    {
      "gate_id": "GATE-NONFINITE-NUMERIC",
      "observed": 1.0,
      "operator": "gte",
      "passed": true,
      "threshold": 1.0
    },
    {
      "gate_id": "GATE-UNICODE-DECEPTION",
      "observed": 1.0,
      "operator": "gte",
      "passed": true,
      "threshold": 1.0
    },
    {
      "gate_id": "GATE-OVERSIZED-PAYLOAD",
      "observed": 1.0,
      "operator": "gte",
      "passed": true,
      "threshold": 1.0
    },
    {
      "gate_id": "GATE-MALFORMED-IDENTIFIER",
      "observed": 1.0,
      "operator": "gte",
      "passed": true,
      "threshold": 1.0
    },
    {
      "gate_id": "GATE-MISSING-VALUE-SEMANTICS",
      "observed": 1.0,
      "operator": "gte",
      "passed": true,
      "threshold": 1.0
    },
    {
      "gate_id": "GATE-TYPE-CONFUSION",
      "observed": 1.0,
      "operator": "gte",
      "passed": true,
      "threshold": 1.0
    },
    {
      "gate_id": "GATE-TRUSTED-INPUT-INTEGRITY",
      "observed": true,
      "operator": "eq",
      "passed": true,
      "threshold": true
    }
  ],
  "release_decision": {
    "blocking_reasons": [
      "Real operational validation has not yet been completed.",
      "Independent security review has not yet been completed."
    ],
    "production_readiness_status": "BLOCKED",
    "stage_gate_status": "PASS"
  },
  "report_id": "AEG-HOSTILE-INPUT-STEP11D-001",
  "results": [
    {
      "control_tags": [
        "boolean_semantics"
      ],
      "defended": true,
      "detection_oracles": [
        "STRICT_PARSER"
      ],
      "ephemeral_only": true,
      "error": null,
      "expectation_met": true,
      "expected_oracles": [
        "STRICT_PARSER"
      ],
      "expected_outcomes": [
        "NORMALIZED_SAFE"
      ],
      "family": "boolean_deception",
      "findings": [
        {
          "code": "FALSE_TOKEN_PRESERVED",
          "message": "The string False was parsed as Boolean false.",
          "oracle": "STRICT_PARSER"
        }
      ],
      "handler": "boolean_false_string",
      "observed": {
        "code": "BOOLEAN_PARSED",
        "normalized_text": "False",
        "status": "parsed",
        "value": false
      },
      "outcome": "NORMALIZED_SAFE",
      "scenario_id": "INPUT-BOOLEAN-FALSE-STRING-001",
      "severity": "critical",
      "title": "False string remains false"
    },
    {
      "control_tags": [
        "boolean_semantics"
      ],
      "defended": true,
      "detection_oracles": [
        "STRICT_PARSER"
      ],
      "ephemeral_only": true,
      "error": null,
      "expectation_met": true,
      "expected_oracles": [
        "STRICT_PARSER"
      ],
      "expected_outcomes": [
        "NORMALIZED_SAFE"
      ],
      "family": "boolean_deception",
      "findings": [
        {
          "code": "TRUE_TOKEN_CANONICALIZED",
          "message": "Whitespace was removed and true remained Boolean true.",
          "oracle": "STRICT_PARSER"
        }
      ],
      "handler": "boolean_true_whitespace",
      "observed": {
        "code": "BOOLEAN_PARSED",
        "normalized_text": "true",
        "status": "parsed",
        "value": true
      },
      "outcome": "NORMALIZED_SAFE",
      "scenario_id": "INPUT-BOOLEAN-TRUE-WHITESPACE-001",